1,Bush surrenders
92,"For the 3rd straight year, Americans flunk a basic 33-question test on their country's history and institutions"
92,"Main reasons Citi deal stinks: 1) It favors shareholders over taxpayers (Reich, Ritholtz and Malkin agree); and 2) It won't stabilize Citi (""Nothing...makes Citi immune to a bank run""-Salmon)"
92,"7.4 Trillion Divided by American Population is $25,000 Owed by Every Man Woman and Child to Pay for Corporate Greed!"
92,"Barack Obama will be bringing the first laptop into the Oval Office. Internet access for the first time, but emails will probably be unavailable."
92,"MN U.S. Senate Hand-Count: A Vote for McCain Must be a Vote for Coleman, Says Coleman Camp"
92,Wal-Mart's GOP outreach director to be charged with wire fraud in Abramoff scandal
92,Several of Bill Clinton's last-minute pardons were for cocaine dealers. Bush is continuing that trend today. Why is this drug singled out for preferential treatment?
93,"Bailout costs more than Marshall Plan, Louisiana Purchase, moonshot, S&amp;L bailout, Korean War, New Deal, Iraq war, Vietnam war, and NASA's lifetime budget -- *combined*! "
93,"Bailouts 101: I pay taxes to the govt. The govt gives billions to bailout Citi. Citi refuses me a loan, but gives millions to a baseball team that charges me $75 for a seat."
93,Prop 8 has become a PR disaster for Mormons
93,"If Bush can pardon a man for conspiring to sell $1.4m worth of cocaine, shouldn't he be obligated to pardon every person imprisoned on lesser drug charges?"
93,"Citigroup says it plans to maintain its $400 million contract with the New York Mets so the Mets new stadium will be called ""Citi Field"". THATS BULLSHIT!"
93,Bush pardons a dude who killed 3 bald eagles. Symbolic?
93,Florida ban on gay adoptions ruled unconstitutional
93,Pentagon to Wounded Vets: Getting blown up by an IED isn't 'combat-related'.  Seriously.
93,"Franken camp finds 6,400 uncounted absentee ballots"
93,Bush plans pardons for war crimes and torture. Support Rep. Nadler’s HR.1531 which condemns such pardons and promises investigations of abuse of Bush’s pardon power.
93,A little-known provision in the Constitution may prevent Hillary Clinton from becoming Secretary of State.
93,Citibank Scam: Why is the U.S. Bailing Out an United Arab Emirates Owned Bank?
93,"Ann Coulter Breaks Her Jaw, Has it Wired Shut. World Rejoices."
93,California to investigate Mormon aid to Prop 8 
93,Ann Coulter's Jaw Wired Shut
93,Column: Impeach Bush before he leaves office
93,Millionaires get farm payments; nobody checking
93,"Private Prisons: They get contracts through lobbying, cronyism and political favoritism. They make their profits through short staffing their facilities and underpaying their staff."
93,Is the insecticide clothianidin killing the bees? Did Bush’s EPA cover it up?
93,"Prominent writers for DailyKos, the country's top liberal blog, are launching a new site to scrutinize and pressure the Democratic Congress."
94,"CitiGroup just paid $400M for the naming rights to ""Citi Field"" for the NY Mets. Now two New York City councilmen are trying amend that name to ""Citi/Taxpayer Field."" "
94,"Mormon church being investigated for prop-8 contributions ""good job, reddit!"" as delusional losers say"
94,Great vid of guy repeatedly nailing economic predicitions while right wingers laugh him off. It pays to be right.
94,Maddow: Why Won't Obama Pursue War Crimes Investigations?
94,Fox News shut out at Obama press conferences.
94,Revealing RNC document leaked
94,Kucinich on bailouts: Execs 'holding parties while the house is burning down'
94,Obama: bank execs shouldn't get bonuses this year
94,Bush: No need to pardon torturers because Democrats have no balls.
94,"At the end of a presidency of stupefying ineptitude, he has become the lamest of all possible ducks."
94,Was the federal government out to get Eliot. Spitzer?
94,"State justice confirms he yelled ""Tyrant! You are a tyrant!"" at Mukasey before AG collapsed"
94,How I Got Through Airport Security with No I.D. (And wait until you read pg. 2-you won't believe it or will)
94,Mormon Church Investigated For Possible Campaign Violations
94,"GM announced that it cancelled a $40 million endorsement deal with Tiger Woods, while Citibank has confirmed its $400 million deal for the naming rights to the new home of the New York Mets."
94,"Obama is now the greatest orator since Cicero, apparently"
94,Don't Bail out the System that Gave Us SUVs and Strip Malls
94,Bush's Last Days: The Lamest Duck
94,Lieberman contributed to GOP Senate and House candidates.
94,Inquiry Set on Mormon Aid for California Marriage Vote
95,GOP's illegal use of military intelligence during election
95,1 in 3 Homeless Men is a Veteran
95,"""AP: Feds warn of terror plotting against NYC subways""  Is it just me or do reports like these make you more scared about what the govt will do than about actual terrorists?"
95,"Jonathan Turley: ""We're all complicit in Bush's war crimes if we ignore them."""
95,GM Asks U.S. FAA to Bar Public Tracking of Leased Corporate Jet 
95,Judge throws out attempt by Oakland GOP to expel Ron Paul supporters
95,"Obama Birth Certificate Researcher ""Dr"" Polarik is a Fraud!- Renowned anti-terrorism forensic researcher (and real PhD!) Dr Neal Krawetz shreds the facade of fake researcher ""Dr"" Ron Polarik"
95,Evangelicals and Mormons Find Common Ground--They Both Hate Our Freedoms
95,"Media Claiming ""Only Liberal Bloggers Complaining About Possibility Of Torture In Future."" Wait You Kidding Me?"
95,"The Lamest Duck: ""In the end, though, it will not be the creative paralysis that defines Bush. It will be his intellectual laziness, at home and abroad."""
95,Rumsfeld's Attempts to Rewrite Himself on the Right Side of History Are Laughable
95,Lieberman contributed to Republican house and senate candidates
95,LANDSLIDE: Obama’s vote margin was actually larger than Reagan’s in 1980
95,How To Keep An Eye On Bush's Midnight Regulations: Screwing America All The Way Out The Door...
95,"""So Bush is handing out pardons to a group of people who helped produce the last financial system meltdown just as a new crop are under investigation."""
95,The death penalty for currency debasement is still law: I'm thinking the Federal Reserve and the Treasury Dept...
95,"UNITY: Robert Gates will stay on as Defense Secretary under Obama. That makes sense since both guys called on Bush to start talking to Iran, revise his Iraq policy and take a new look at Afghanistan."
95,"Jewish Group Breaks Off Contact with LDS (Mormon) Church Over ""Baptisms"" Performed On Holocaust Victims"
95,"If American's were willing to stand up like this, America wouldn't be so screwed up.  Way to go Thailand."
95,"US Government Bankster Bailout Hits $8.5 Trillion - An Even Bigger, More Profitable Scam Than the Wars on Drugs, Poverty &amp; ""Terrorism""!"
96,"US physicist criticizes government treatment of muslims. Bush appointee strips him of his security clearance, costing him his job of 28 years."
96,"New York angry, calling for Citi Resignations, ""It's ridiculous. If I did as poorly as they did in my job, I would be out of the job, so why are they not accountable?"" "
96,"THE NEW REPUBLICANS: Infuriated with extreme right-wingers, a genuinely progressive Republican movement is beginning and it's trying to force the party into the 21st century."
96,Sean Hannity gets called out for lying on 15 occasions by John Podesta. Sean Hannity edits the interview to make Podesta look bad.
96,"Cheney has $85 million invested in Vanguard and in turn, into abusive prison companies. DA says “Elected officials were embedded into the prison business and it goes all the way to the top.”"
96,"If Obama Doesn't Prosecute Bush's Torture Team, We'll Pay a Big Price Down the Road"
96,Scooter Libby Case - Never before has a president pardoned himself or his subordinates for crimes he authorized
96,"Rupert Murdoch ""Absolutely Despises"" Bill O’Reilly"
96,"Bush, a Man Who Liberated Billions from Our 401ks"
96,"As a percentage of total population, Obama's vote was the second biggest in U.S. history, and the biggest ever for a non-incumbent. "
96,"Get your facepalm ready for this one: ""KY law requires Homeland Security to credit God"""
96,Prosecute Bush No Matter What the Cost
96,Why Obama Should Keep the BlackBerry
96,Obama names 7 gays to transition team 
96,Forbes magazine President Steve Forbes called Treasury Secretary Paulson “the worst treasury secretary we’ve had in modern times
96,Follow the Government's  $8.5 trillion Bailout - &gt; The Breakdown .. ( JPG )
96,Voter Remorse On Proposition 8 In California
96,New friendly fire coverup: Army shreds files on dead soldiers [crazy video] 
96,"Don't Worry, the Ultra-Rich Are Doing All Right "
96,Why can't we find Torturers accountable and find out the truth?
97,"An eight-year-old US boy accused of murdering his father and a family friend kept a tally of his parents' smackings, vowing that the 1,000th time would be the last"
97,"When companies become so large they can't be allowed to fail, it's no longer free market capitalism. It's the corporate nanny state."
97,George W. Bush Belongs in Prison
97,"Oklahoma has become the reddest state in the union by irreversibly linking fundamentalist Christianity with Republicanism, and they're only shifting further right"
97,"Henry Ford on Bailouts: ""Let them fail; let everybody fail!  If I lose everything in the collapse of our financial structure, I will start in at the beginning and build it up again."""
97,"Bill Kristol Calls On Bush To Pardon Torturers And Wiretappers, Reward Them With Medal Of Freedom"
97,"No Child Left Behind Act: A ""Trojan Horse"" For Pentagon Recruiters "
97,How the Federal Reserve System Transfers Wealth from Society to the Creators of Money and Corporate Interests
97,Scumbag Bill Kristol Argues For Medal Of Freedom For Those Who Committed Torture...
97,Would you like some more poison in your baby formula?  Thank George Bush
97,Mocking the French Surrender of 1940 is as funny to the French as 9/11 is to Americans. Time for some mutual respect.
97,"Chomsky: Is There Truth in Obama's Advertising? |In a fascinating speech, Chomsky warns, ""Changes and progress very rarely are gifts from above. They come out of struggles from below."""
97,"Who Knew?  Faux ""News"" Channel's Greta Van Susteren In A Scientologist"
97,Prescription Drugs Kill 300 Percent More Americans Than Illegal Drugs
97,Wall Street scammers who have gotten trillions in bailouts now have hurt us far more than any terrorists have
97,The problem is that the Bible isn’t meant to be read. It’s meant to be quoted by people in power. 
97,Atheists Sue Religious-Minded City Over Billboard
97,"AIG Pulls Fast One -- ""Cash Awards"" Going To Managers"
97,Bush is Promoting Himself as a Model President
97,"the Daily Show - Bush Speech 10:20am - Fed Speech 10:20am - George Bush really does not mind lying to your face, for say 20 minutes or so. No Problem. Man he's a good liar.[Video]"
98,"Gays are treated as more dangerous than felons, drug offenders and known child abusers -- none of whom is categorically barred from adopting."
98,"Al Gore On the Auto Bailout: ""The Govt. Invested Over a $1B In the Big Three for Development of Green Technology.  In 2000, Once They Were Off The Hook, They Walked Away"""
98,Bush Planning To Issue 20 'Highly Contentious' Rules In Final Weeks
98,"Those who think corrupt, political Generals only exist in the Third World should look at the slimy career of US Gen. Barry McCaffrey"
98,"No particular political point here, but I believe people might want to ask why...  Mumbai attacks that killed about 150 get nearly non-stop coverage while death of 300 in Nigeria barely mentioned"
98,"Why going ""Made in the USA"" for a week left me hungry, broke, and half-naked. "
98,Former interrogator slams torture: Torture has cost nearly as many lives as 9/11. 
98,Bush's Rush to Enact Rules Obama Opposes [non-link jacked]
98,Robert Rubin has to go from Obama's team; He is at the center of the financial crisis and continues to blame everyone but himself.  That is not change we can believe in.
98,Writ of habeas corpus. It is a basic ideal of justice: No person should be locked away in prison and not allowed to seek help to challenge the illegal imprisonment. 
98,FDA Draws Fire Over Chemicals In Baby Formula - melamine &amp; cyanuric acid
98,"""The highest use of capital is not to make more money, but to make money do more for the betterment of life.""  - Henry Ford "
98,"Documents Obtained By ACLU Provide More Evidence Abuse Of Iraqi Prisoners Was Systemic (Including: Food &amp; Sleep Deprivation, Misuse of Tasers, Sexual Threats, ""Stress Positions"" and Assaults By Dogs)"
98,Palin Slammed By Hometown Paper For Georgia Campaigning
98,"Former Bush advisor: Obama will have “one of the most pragmatic, least ideological cabinets that we’ve seen in a long time”"
98,An amazingly in-depth look at Bernanke and his reasoning behind the bailouts. Very Long but required reading for anyone that wants to understand what is really going on in the financial markets.
98,Georgia Residents! Don't let Saxby get away with this! Vote Martin!
98,our post-bailout world in one word
98,One Man's Military- Industrial-Media Complex.  He works for NBC and shill for a defense contractor.
98,Obama likely to name Hillary Clinton to Cabinet. But wait! Can he?
99,"Pentagon to deploy 20,000 troops on US soil"
99,Jeb Bush suggests the GOP set up a shadow government to provide a counter-agenda to the new democratic majority. Hasn't this family already done enough damage to the United States?
99,"AMERICA? 77% want kids to say pledge every day and a majority want to force kids to say ""under God"" regardless of whether or not they're believers."
99,Change.gov (Obama's transition website) is now under a CREATIVE COMMONS license!
99,90 Percent of U.S. Infant Formula May Be Contaminated with Melamine; FDA Abruptly Declares Chemical Safe for Babies
99,Medical Students Fed Up with Professors' Secret Financial Ties to Big Pharma
99,"Republicans still going apeshit:  ""Liberals Don't Know What Patriotism Means"""
99,OF COURSE: Bush ignored regulations proposed in 2006 that could have prevented the housing meltdown. Why? Because banking interests said they weren't needed.
99,The pharmaceutical industry really doesn't want you to know some patent protected drugs are less effective than cheap alternatives. 
99,"Jeb Bush: GOP Should Set Up ""Shadow Government"""
99,"Matthew Alexander, the military officer/interrogator responsible for obtaining information that led to the death of Abu Musab al-Zarqawi provides a scathing indictment of U.S. torture policies"
99,"Conservative crowd cheers when Palin mentions 9/11, Iraq.   Republicans STILL dumb."
99,The food and soap manufacturing multinational Unilever has announced that it will divest from an Israeli factory in a Jewish settlement illegally built on land confiscated from Palestinians.
99,Bush Administration Weakened Lending Rules On No Money Down and Interest Only Mortgages Before Crash By Request of Banks That We're Now Bailing Out
99,"So much for No Child Left Behind.  By third grade, poor children have vocabularies of about 4,000 words compared to 12,000 for middle class kids."
99,George W. Bush Belongs in Prison
99,Bush admits ‘I was unprepared for war.’  Pretends the war was unplanned.
99,"On World Aids Day, hundreds of HIV positive African women stand up and denounce George Bush's policy of paying religious groups millions to promote abstinence-only AIDS prevention in Africa."
99,"Pentagon Plans To Keep 20,000 Troops Inside US To Bolster Domestic Security"
99,"For Nearly A Year After Recession Started, Bush White House Insisted That ‘We’re Not In A Recession’ "
100,"GEORGIANS: Run-Off Election is today! Find your polling place here, get out and VOTE."
100,"Bush will announce a ""right of conscience"" rule permitting doctors to refuse to participate in any procedure they find morally objectionable (abortion, artificial insemination, birth control)"
100,What torture doesn't do: Find enemy leaders.  What torture does: Gets American troops killed.
100,"Towns, cities and counties in at least 24 states are now charging citizens if they have to respond to accidents and fires. Pushed by private vendors. I thought that was what taxes were for!"
100,"""Rove Is A Common Criminal"" .. Rove ""Destroyed Emails That Would Have Revealed His Role In Extending [Iraq] War"""
100,"""Impeach Bush"" ornament winds up on White House Christmas tree"
100,Perhaps the most striking aspect of president George W. Bush is his inability to actually take responsibility for anything
100,Al Franken now down by only 13 votes
100,"Atheists want God, Bible out of homeland security law"
100,"Peter Schiff: ""By trying to force feed even more credit down the throats of already overly indebted Americans, Paulson's plan will only weaken the economy further."""
100,Someone in the Senate Is Blocking The Nomination Of A Bailout Watchdog
100,"After 9/11, Rove pressured the entertainment industry ‘to produce propaganda.’ "
100,For those following the events in Canada: An explanation of how and why the neocons are being removed from power 
100,"The police have no right to shoot people with electricity for having a ""bad attitude."""
100,"Your bailout money at work - Mets' new ballpark will remain Citi Field (400 million $$). Mets chief operating officer says, ""It's not really Citi's fault that they're in this problem."""
100,GOP'S GOD PROBLEM: Religious conservatives seem to not realize that we are a multi-religious society. They really believe that the GOP stands for “God’s Own Party.”
100,Rich bastard who thinks he rules the world tells the world what it should do. Bastard who never worked a day in his life tells us we should work harder. 
100,Icelanders Storm Central Bank
100,Coming soon to an airport near you: Orwell's Thought Police
100,Canadian Conservatives to be shown the door ... Yay for coalition governments!!
101,"""Under God"" has its origins in the Red Scare and is no longer relevant in today's America. The Pledge should reflect America's faith in liberty for all, not the religion of most."
101,"I'm sick of this fucking ""Wartime President"" bullshit. Vote up if the last ""wartime president"" we had was Harry S Truman, not any of his Police-Actiontime President successors."
101,"Thinking she's the victim of a radio station prank, Florida Congresswoman hangs up on man claiming to be President Elect Obama. The problem? Yep..."
101,"Michael Moore: ""You could buy all the common shares of stock in General Motors for less than $3 billion ... Take the money and buy the company!"""
101,Novak: ‘I Don’t Think I Hurt’ Valerie Plame And I Would Out Her Again Because The Left ‘Tried To Ruin Me’ 
101,Nick Dial was a police officer who volunteered to be Tasered. Since then his health has suffered to such an extent that he can no longer work. And he's not alone
101,Karl Rove: We Wouldn't Have Invaded Iraq If We Knew The Truth About WMDs - I call Bullshit!
101,"India's Wondering, 'If the U.S. Can Bomb Pakistan, Why Can't We?'"
101,"SAD: Over the past 20 years, college tuition has gone up 439% and is quickly becoming unaffordable for most Americans."
101,The Bailout Isn't Being Policed Properly: Government Accountability Office
101,"The Daily Show on the Mumbai Tragedy: ""There have always been motherfuckers, there will always be motherfuckers, but what we can't do, is let them control our motherfucking lives."""
101,How the hell can GE pay a dividend and STILL get bailout money???
101,Democratic staffers returning to Washington after 8 years are shocked by how much the bureaucracy expanded under Bush.
101,"Hannity: ‘If You Don’t Listen To Talk Radio, If You Don’t Watch Fox News,’ You’re Misinformed "
101,"ANOTHER FEMA FAILURE: Two months have passed since Hurricane Ike hit the Texas coast, and there is still substantial damage and many state authorities are accusing FEMA of dragging its feet."
101,"Soldiers sue war contractor over exposure to cancer-causing dust, ensuing cover-up"
101,Chicago Cops Caught in FBI Drug Sting
101,"Walter Cronkite  ""Indeed, we are in another Vietnam. Almost play by play. It's a terrible mistake that we're in Iraq, and it's a terrible mistake to insist on staying there."" "
101,ACLU: GOP Documents Reveals Military Involved In Convention Security Planning 
101,Franken: we're up by 22 votes
102,"Obama To Every Single Bush Ambassadorship Political Appointee: ""Your services will no longer be required come January 20th."""
102,"What would Jesus have to say about atheist displays in public places? Nothing. He'd be too busy with the hungry, the sick, the homeless, and the outcast. "
102,UK Database State Suffers Setback - No Longer Allowed To Keep DNA of Innocent Citizens On File
102,"Bush's worst midnight regulation yet: Approval for coal companies to dump the rock and dirt waste in ""mountaintop removal"" coal mining into streams and valleys"
102,Video of Reagan dedicating Columbia launch to the *Freedom Fighters* in Afghanistan.  
102,Bill O'reilly Cries Over Atheist Display at Washington State Capitol 
102,Dennis Kucinich Sticks Up For Palestine and Urges Israel to End Blockade on Gaza
102,"The sanest thing you will ever, ever read at redstate.com: ""We lost because we suck"". Read it now before they delete it and edit ""You"" entry on Conservapedia to read ""YOU SUCK""."
102,"""And what Dr. Stevens says about the morning-after pill—that it ""prevents the embryo from implanting""—is such a gross misrepresentation that it's amazing he's in charge of any medical association."""
102,Somehow 133 ballots vanished in one Minnesota precinct that went strongly for Al Franken.
102,"Ronald Reagan and his administration ignored the AIDS crisis for years, even opposing education efforts, while thousands died in the U.S. and around the world"
102,Al Gore leads new ‘Reality’ Coalition to debunk ‘clean coal’ myth. 
102,"At long last, we’re about to change presidents. Is it too much to ask that we throw out all our pundits who have been blowing hot air and lies for so long?"
102,"Thomas Jefferson, 1802: ""I believe that banking institutions are more dangerous to our liberties than standing armies"""
102,A St. Louis city leader frustrated with the police response to rising crime called Tuesday on residents to arm themselves to protect their lives and property.
102,Falling Prices - Why is food not part of this trend?
102,"Cop issues ticket to man driving his wife, who is in labor, to the hospital "
102,Bush and Rove Launch ‘Legacy’ Campaign to Rewrite History 
102,Why do Feinstein and Wyden sound much different on the torture issue now? - Glenn Greenwald
102,"College May Become Unaffordable for Most in U.S. Outpacing medical, housing, food.  When's the education bubble going to burst?"
103,Who thinks Obama should switch us over to the Metric System?  
103,KBR sued for giving soldiers ice with 'traces of body fluids and putrefied remains!'
103,"Andrew Sullivan questions Sarah Palin was pregnant with Trig. ""Please make me look like an idiot for asking these questions,"" he writes."
103,"Bill O'Reilly quitting radio permanently. Fuck it, he'll (no longer) do it live!"
103,Vote to appoint Dennis Kucinich as Secretary of Peace in the Department of Peace and Non-Violence in the Obama Administration
103,Blackwater Guards Could Get 30 Years In Jail For Massacre
103,"The United States now spends more on healthcare than any other developed nation, yet has some 47 million people without health insurance"
103,Massive Crowds Turn Out To Protest Obama’s Falsified American Citizenship
103,"Lost Votes on Diebold System Discovered by New 'Transparency Project' in CA | Company Knew About Problem on Widely Used Tabulator Softare, Failed to Inform County"
103,Our mission in Iraq is to prop up our puppet regime so they don't sell oil for anything but dollars. Rated 3rd most corrupt regime in the world
103,Two trillion is handed out by the Federal Reserve. The media is all over The Big Three. Are we that stupid? Yes
103,NY congressman plans to introduce a constitutional amendment to cut Presidentail pardon powers.
103,"Palin's campaign expenses include trips to Dick's Sporting Goods, The Limited, Foot Locker, Wal-Mart, Toys R Us and Victoria's Secret .  WTF?"
103,Taxpayers Shouldn't Have to Give their Money to Companies whose Products They Choose Not to Buy
103,"SWAT Team &amp; Ohio Department of Agriculture Agents Storm Food Co-Op &amp; Hold Parents, Kids &amp; Toddlers at Gunpoint for 9 Hours, Stealing $10k+ in Merchandise Without Explanation"
103,Supreme Court agrees state medical marijuana laws preempt Federal laws!
103,"RedState Founder, Erick Erickson, Says the Obama Birth Certificate Drama is a Non-Issue and Attacks the Credibility of People Who Think it is."
103,The biggest mistake Obama could make now would be to buy into the War on Terror.
103,Ron Howard: Jon Stewart should do Bush exit interview
103,"Is Sarah Palin Being Christened as De Facto Leader of the GOP? | Sarah Palin is a walking, talking psychobomb -- and she's on the verge of becoming the face of the Republican party. "
104,"Ex-cop turned whistleblower baits local police by renting a house where he uses grow lamps for Christmas trees.  Local cops somehow find ""probable cause,"" launch raid, now have some 'splaining to do."
104,"Ohio authorities storm a farm house, hold family at gunpoint for 9 hours, confiscate over $10,000 worth of food, computers and cell phones.  Why?  They run a private, members-only food co-op."
104,"Bailouts so far: $2 trillion. Basic health, nutrition, education for world for 71 years: $2 trillion. Understanding the government's priorities: priceless. "
