1,Bush surrenders
1,Diebold Admits Their Tabulator Software Doesn't Count Votes Correctly: CNN's Lou Dobbs Covers Stunning Admission...
1,"BBC: Bush, Cheney, Rumsfeld, Wolfowitz, Rice are all GUILTY of a CRIMINAL CONSPIRACY to invade Iraq!"
1,Real heroes don’t go on and on and on and on and on and on and on and on about their own heroism – particularly in order to satisfy personal ambition
1,Cindy Sheehan surprises wiretapper - This is Cindy Sheehan's account on what happened to her when she came back to her hotel room early following a day of activism in Denver
1,T. Boone Pickens wants your water (His wind-project is just a fancy package to hide a lucrative water-grab)
1,FACT: John McCain's Voting Rated ' D ' On Veterans' Issues. Obama Is Rated ' B+ '
1,"Jon Stewart ripped the cable news networks Monday as a ""brutish, slow-witted beast"" and castigated Fox News as ""an appendage of the Republican Party."" "
1,AT&amp;T Throws Party to Support Dems Who Voted to Grant Telecoms Immunity for Illegal Domestic Wiretapping
1,"FOX News ""mistakenly"" airs potentially illegal anti-Obama ad"
1,Kucinich Pursues Impeachment to Prevent 'October Surprise' Attack on Iran
1,Olbermann: Bush Administration Caught LYING about IRAN Supplying WEAPONS TO INSURGENTS! [VIDEO]
1,WATCH: Ron Paul Tears Into John McCain
1,Upmod if you think George Walker Bush has violated his oath to uphold and defend the Constitution of the United States of America.
1,"The McCain campaign keeps emphasizing that McCain was a prisoner in Vietnam, as proof of his qualification for the Presidency.  Well, so was Gary Glitter, and I'm not voting for him either."
1,American soldiers after war in Iraq [Pics]
1,"""Don't Know Much"" - Obama Stays on the Offensive with New Ad"
1,Ron Paul's Rally for the Republic: Join us in Minneapolis!
1,Olbermann: Is Condi Rice a LIAR or just a plain old IDIOT?  [VIDEO]
1,"Contractors Lose Immunity In Iraq...Washington has conceded that private security contractors, of whom 35,000 out of 154,000 are armed security personnel, should no longer have immunity  "
2,"""That's not a maverick, that's a sidekick!"" Bob Casey on McCain's voting record. Upvote if you want to hear this over and over again in the media!"
2,"Young Obama Supporter ""Owns"" Clintons 4 McCain Spokesperson At Convention; Amazing what calm intelligence can do to make someone else look retarded."
2,"Dennis Kucinich  *R-O-C-K-S*  THE HOUSE!   WAKE UP AMERICA!  ""If there were an Olympics for MISleading, MISappropriating and MISmanaging, this admin would take the GOLD!"""
2,Plot to kill Barack Obama: Three 'white supremacists' arrested
2,"Kucinich's ""Wake up America!"" DNC speech"
2,Dear McCain: Where do I sign up for the $50/hour lettuce picking job?
2,Dennis Kucinich at the DNC: Wake Up America!  Fantastic!
2,"A large-breasted woman was accosted by TSA when her underwire bra set off the magnetometer. She was given a choice: allow her breasts to be fondled or give up on flying. Instead, she raised a stink."
2,"Romney: McCain ""Earned"" His Many Mansions Through ""Hard Work"". Yeah, I Bet He Really Worked up a Sweat Screwing a Rich Woman Half His Age While His Wife Was in the Hospital"
2,Rep. Dennis Kucinich says Bush Admin Let 9/11 Happen
2,"Harold Simmons, the rightwing billionaire behind the anti-Obama ad was sued by his own daughters who accused him of making illegal campaign contributions using their trust fund. "
2,Utah State senator is rude to a pizza delivery girl that had a little known blog until now
2,"Not reading your Orwell?  You're not alone. See Hannity's ""Enemy of the State"" segment &amp; McMansion's campaign calls their anti-Dem media outlet the ""Ministry of Truth""."
2,Dennis Kucinich lays it down and wakes'em up at the convention. Wake Up America!
2,POW is to McCain as 9/11 is to Giuliani.
2,"Dennis Kucinich, once again, kicks ass."
2,Lawmaker thinks surveillance cameras are awesome until one is installed near his house
2,"250 pound male cop slams 100 pound female protester to the ground, then arrests her before she can talk to the press. "
2,"LENO: “For a million dollars, how many houses do you have?”  SEN. McCAIN: “Could I just mention to you, Jay, that, at a moment of seriousness. I spent five-and-a-half years in a prison cell,” "
2,"Judge Denies White House Request for Stay, Says Miers Must Testify"
3,"Jon Stewart to print reporters: ""How can you keep talking to people who are lying to you? This loveless marriage has to be unconsummated"""
3,Richards: “A woman voting for John McCain would be like a chicken voting for Colonel Sanders.” 
3,Media Blackout: Bush has quietly sent the largest armada into the Persian Gulf since the Iraq war began in 2003:  Why?  Oil? An attack on Iran?
3,"Here in Denver this week, House Speaker Nancy Pelosi has been heckled by fellow Democrats nearly everywhere she goes."
3,"ABC Reporter Arrested in Denver Taking Pictures of Senators, Big Donors"
3,"Classy move, Hillary: Hillary interrupts nominating process to move that Obama be nominated by acclamation. Obama now official nominee!"
3,"The new “Free” Speech: If you insist in your 1st Amendment rights you can exercise them in a locked wire cage in a warehouse, closely guarded by Imperial Storm Troopers, to make sure you are not heard"
3,Joe Scarborough had an affair with his intern and then killed her 
3,"Real straight talk: Jon Stewart ripped the cable news networks as a ""brutish, slow-witted beast"" and castigated Fox News in particular as ""an appendage of the Republican Party."""
3,"Ohio GOP illegally funneled $500,000, allegedly to Blackwel"
3,Video: Cop bashes Lady then ARREST her for talking to the Media DNC Denver code pink
3,"Indicted Senator Ted ""Series of Tubes"" Stevens From Alaska Wins Republican Primary"
3,"Why does Watergate felon G. Gordon Liddy count John McCain as a good friend?  Why is McCain “proud” of this convicted felon, who has plotted to murder journalists and kill government agents?"
3,"Is it FAIR to go after McCain's age and diminishing health concerns?  Why not?  He's showing no restraint on the ""inexperienced"" meme."
3,Stephen Colbert makes fools of Fox News and William Kristol
3,"If you watched the Democratic Convention on a major news network, you probably weren't shown one of the best speeches of the night. Your next, next President, Montana Governor Brian Schweitzer"
3,"Glenn Beck: ‘We Shouldn’t Spend A Single Dime’ On New Orleans, Residents Should Just ‘Move Out’ "
3,"Abramoff sentences could come as early as next week, during the Republican convention."
3,"Finally!  Obama in Montana: ""We honor John McCain's service ... but we don't owe him our vote."""
3,"Cheney slams ""unjustified assault"" on Georgia... haha... have you found your WMDs yet?"
4,The Straight Talk Express Has Derailed - Amazingly Bad McCain Interview
4,McCain advisor: There are no uninsured Americans
4,"Whoops! Top Republican Admits That GOP Is Running ""Ministry Of Truth"" Against Obama"
4,Time.com - Is McCain overplaying the POW card?
4,What is the Keating Five?
4,"""The American Republic will endure until the day Congress discovers that it can bribe the public with the public's money."" Alexis de Tocqueville 1805-1859"
4,"Cindy McCain's Half Sister: ""I'm Voting for Barack Obama"""
4,"And with these words, Bill Clinton began to gain back my respect, ""People around the world have always been more impressed by the power of our example than by the example of our power."""
4,   	  Halliburton sued for human trafficking
4,"Police kill 23-year old dude while his mother watches from her front lawn, won't let her perform CPR."
4,"Golden, CO Shows the World How Far We've Sunk"
4,"John Kerry Kicks ""Candidate McCain"" Straight in the Nuts.  Holy Crap, if Kerry Had Fought Like this in 2004 He Would Have Been President. [vid]"
4,McCain’s Health Care Architect: There Are No Uninsured Americans
4,"To Provoke War, Cheney Considered Proposal To Dress Up Navy Seals As Iranians and Shoot at Them"
4,"TSA agents can slap fines on Americans based on ""attitude."" TSA has issued no guidance on the precise amount of obligatory groveling at airport checkpoints."
4,Ron Paul on CNN - 08/28
4,1989 Newspapers Ripped McCain Over Keating Five
4,"President Carter Points Out That If You Milk the POW ""Thing"" for Too Long, The Milk Becomes Sour"
4,Police arrest journalists trying to get the skinny on Democratic senators and VIP donors
4,"McCain struggling to fill venue for VP rollout. Pulling people from other states to Ohio. Obama pulls 80,000. McCain - desparate for 10,000"
5,Upmod if you think that the only reason Mccain picked Sarah Palin is to court Hillary's Legions of Voters
5,Vote up if you thought Obama did a good job with his speech
5,It's official:  Sarah Palin is McCain's VP Pick
5,Palin Pleased with Obama's Energy Plan. Wait. What? Page Removed...
5,"Vote up if you are sick of ""Liberal"" being used as a negative adjective."
5,McCain VP Pick Wants Creationism Taught in Alaskan Classrooms
5,"The day before McCain's announcement, someone made dozens of edits to Sarah Palin's Wikipedia page to make her look like a better candidate."
5,McCain VP Sarah Palin Under Investigation for Abuse of Power
5,Previously on Reddit... rumors that Sarah Palin is covering up the pregnancy of her 16 y/o daughter
5,"Does anyone else find it deliciously ironic that the far right prayed for ""hurricane strength rain"" at the Dem convention, and there's a hurricane about to screw up the Repub. convention?"
5,"Please circulate this picture of the new Vp pick, Sarah Palin.  Trust me.  It's faptastic [pic]"
5,Sarah Palin: Ten Reasons to Vote DEMOCRAT
5,"Sarah Palin is no Hillary Clinton and Women Aren't Lemmings, John McCain"
5,"One Alsaskan's Opinion: Sarah Palin is profoundly, staggeringly ignorant about foreign policy."
5,"I step away from reddit for 1 hour, and when I come back I find McCain has made the worst VP pick since John C. Calhoun. SWEET!"
5,"Sarah Palin is an outstanding pick for conservatives: she's anti-choice (even in the case of rape), anti-science, and has a corruption scandal brewing back home. Brilliant!"
5,"Obama Nails It...Bush sends word he may back out of GOP Convention, McCain looking to postpone"
5,Did you know Sarah Palin's husband works for BP offshore oil co?
5,Nielsen: Almost 40 million watch Obama speech
5,Did Palin Really Fight The “Bridge To Nowhere”?  She was very much FOR the bridge and insisted that Alaska had to act quickly...
6,"Ron Paul billboards in Minneapolis: ""We're being taxed to blow up bridges in Iraq and rebuild them, while ours at home are falling down."""
6,WTF!? Massive police raids on suspected protestors in Minneapolis. Since When is Protesting a Crime?
6,"Also, Palin is being introduced even as the Alaskan Legislature is investigating her firing of the state's public safety commissioner in July. "
6," Bush quietly seeks to make war powers permanent, by declaring indefinite state of war"
6,"Presidential scholars say [Palin] appears to be the least experienced, least credentialed person to join a major-party ticket in the modern era. "
6,"So far, this is the most convincing 'Sarah Palin is not the mother of Trig Palin' article I've read."
6,Jaw drops a little lower...audio of Sarah Palin talking about her views on Iraq policy earlier this month. Listen to it. Seriously. She makes Bush sound coherent.
6,Sarah Palin scrubs her own Wikipedia entry?
6,"Palin ""opposes the use of birth control pills and condoms even among married couples"""
6,"6 weeks before baby Trig was born.  Hmmm, now who here looks pregnant?  "
6,Palin's First Lie as VP Nominee
6,Alaskan Governor's child may be her daughter's? 
6,"Feminism: Palin, do you realize McCain is looking at your ass right now, playing with his wedding ring?"
6,Blackwater mercenaries are operating inside the United States as well as training Canadian troops: The privatization of fascism
6,Poll: Voters uncertain on Palin; lowest approval numbers since Quayle
6,38 Million View Obama’s Speech; Highest-Rated Convention In History
6,AP: Ron Paul followers gathering for own convention
6,Who else is as excited as I am to see Biden destroy Palin in a debate?
6,New Rule: You can’t put a windmill in your ad if you’ve voted against every single bill that might lead someone to actually build one.
6,Massive police raids on suspected protestors in Minneapolis - Glenn Greenwald
7,Sarah Palin thinks the Pledge of Allegiance was written by the Founding Fathers
7,Palin Fired City Employees For Not Supporting Her Reelection
7,"Wake up America, Sign up: Kucinich asks for a million signatures by Sept. 10 to send a powerful message to Congress that Americans want to reclaim the Constitution and hold Bush Admin accountable"
7,"Hey reddit, Kucinich wants 1,000,000 signatures for impeachment before Sept. 10th...go, go, go!!!"
7,"McCain Says He Is ‘Obviously’ Against Torture, Forgets His Vote To Allow Waterboarding "
7,"Evangelical Fail: Focus on the Family prays for rain on Obama's speech, and instead Hurricane Gustav threatens the GOP convention"
7,"Sarah Palin, McCain's VP choice, sued the government to reverse listing polar bears as threatened under the Endangered Species Act.  It might interfere with more oil drilling."
7,If Sarah Palin was a man being nominated for vice president she would be laughed out of politics and so would John McCain. 
7,John McCain's selection of Alaska Governor Sarah Palin for VP was greeted by “literally laughter” in “very many newsrooms”
7,McCain voted against Katrina relief multiple times
7,"FBI spied on protest groups in Minnesota prior to raids, despite no evidence of wrongdoing"
7,Cindy McCain: Palin Has National Security Experience Because... Alaska Is CLOSE TO Russia!?
7,"Well, the bill of rights was nice while it lasted."
7,"Republicans Come to Town, Police Raid House of Peace Protest Kids, Hold Them at Gun Point and Refuse to Read Them Their Rights [Video]"
7,"Palin Laughs As Opponent Is Called ""Bitch,"" ""Cancer,"" Mocked For Her Weight (AUDIO)"
7,Sarah Palin left the town of Wasilla with $20 million in long-term debt
7,"Breaking: As Police Mass Downtown and 9 More People Are Arrested, Legal Groups File Emergency Motion to Stop Cell and Camera Seizures During RNC "
7,"McCain Only Has An 85% chance of surviving his first term, are we seriously willing to take the 15% chance that Palin could be be PRESIDENT?"
7,"Cindy says Obama ""went over the line"" and that her father ""is the American dream!""  But her father was a convicted felon, allied with mobsters, whose fortune was based on gambling and liquor."
7,Breaking at RNC: A Nun and Eight Others Swept into Unmarked Van by Police in Minnesota
8,They say Palin's daughter is a private family matter and shouldn't be covered... Then why the fuck should there be national abstinence programs or laws on abortions?
8,Police illegally search journalists at RNC Convention as part of an intelligence operation against protesters
8,"Obama to Media, Politicos on Palin Pregnancy Story: ""Back Off!"""
8,Thank you Sarah Palin - my mother is FINALLY voting for Obama
8,Palin´s candidacy implodes faster than I can post - She was a director of Steven´s 527 group*
8,"US Gestapo: Suppressing dissent. Police raid an activist meeting. Everyone, including a 5-year-old, was detained, handcuffed, and photographed. Computers and notebooks were seized."
8,Video of Amy Goodman's Arrest at RNC
8,"VIDEO:  Moments before McCain's VP Announcement, Joe Scarborough and Pat Buchanan mock as ridiculous the possibility of Sarah Palin being named McCain's running mate."
8,Iraq war still unpopular even as U.S. deaths plummet 
8,U.S. troops killed by Iraq roadside bomb 
8,"Political dirty tricks and misinformation close to election time are, of course, nothing new."
8,"""Cops are indiscriminately using tear gas and pepper spray at 7th and minnesota streets. Help needed ASAP: water, medics. Journalists gassed."""
8,Palin belonged to Alaskan Secessionist Party
8,"Frank Zappa in 1988: ""The biggest threat to America today is not communism; it's moving America towards a fascist theocracy and everything that has happened during the Reagan administration."""
8,U.S. Military To Be 30 Percent Robotic In Twelve Years view!
8,"Palin's resume ""is as thin as the meat in a vending machine sandwich"" (Anchorage Daily News editorial)"
8,"RNC Raids Have Been Targeting Video Activists - ""Their Crime.  None Whatsoever."" (...or maybe holding a camera is ""illegal"" near the Repub. convention?)"
8,"Nowhere in the Constitution does it allow the President, appointed or elected, to declare war at his whim, or remove the protection of the Bill of Rights from any person."
8,"Iraqi police recruits, soldiers killed in bombing "
8,Amy Goodman illegaly Arrested At RNC 
9,Do you think the Republicans would lay off of Obama if his 17 year-old daughter had gotten pregnant out of wedlock?
9,"Palin wanted to ban books from the local library, tried to fire librarian for refusing"
9,"Infuriated About Tough CNN Interview, McCain Cancels Larry King Appearance"
9,"James Carville eats Palin supporter, Representative Michelle Bachman (R-Min), alive on Larry King.  Watch her eyes."
9,"Rough review from Time Magazine: Palin's time as mayor is defined by religion, book banning, corruption and cronyism"
9,Palin cut off money to help teenage mothers learn to raise children on their own
9,"Seen at RNC: ""God Bless America..."" [pic]"
9,"""I'm a f---in' redneck""  and ""I don't want kids"" says the MySpace page of Bristol Palin's babydaddy."
9,"Palin's Alaska Hometown of 6,700 Received $27,000,000 in Federal earmarks, including a $15M rail project to Ted Steven's ski hamlet. McCain: ""[She] stopped government from wasting taxpayers' money."""
9,"John Mccain ""Negotiating"" with Ron Paul in Minnesota For Delegate Support, Paul Says Only If I Speak and My People Are Allowed Inside "
9,Sarah Palin supported the succession of Alaska from the United States. Isn’t that… unpatriotic. 
9,Why Can't Sarah Palin Release Her Medical Records? Because Sarah Palin is Lying--Again
9,There is no walking through downtown St Paul without coming to the absolute realization that we are not safe and most certainly not free.
9,Sarah Palin is the latest GOP distraction. She’s meant to shift attention away from the real issue of this campaign -- the awful state of the nation after years of Republican rule.
9,Sarah Palin Cancels Her Tuesday Night RNC Appearance
9,Do you think the Republicans would lay off of Obama if his wife had been a registered member of a separatist group for SEVEN YEARS?
9,"McCain Goes Vindictive On CNN, Cancels Larry King Live Appearance...not happy that Tucker got questioned on specifics detailing Palin's experience...""CNN went over the line"""
9,"President Bush praised Senator John McCain on Tuesday for his strong support in sending additional troops in Iraq, saying he “helped change history,”."
9,"Palin couldn't run a car wash-literally, the one she owned was shut down by the state when she failed to follow state regulations"
9,"The Palin scandals are really about the competence and judgment of John McCain.  And on that score, McCain looks like the utterly incompetent, rash, overconfident and desperate candidate that he is. "
10,"Two conservative commentators on MSNBC, after they're off the air, caught saying what they really think about the veep choice."
10,"There is a remarkable and palpable fear abroad in this land - not a fear of terrorism, but a fear of speaking up, a fear of being labeled as ""different"" or as a ""troublemaker."""
10,Biden: Criminal charges against Bush Admin. on the table
10,Ironic: McCain criticized Palin for earmarks 3 TIMES in recent years
10,"People for the American Way call on Palin to clarify her stand on freedom of speech, given her attempt at book banning"
10,"If this is McCain's choice for Vice President, you can imagine whom he will nominate to the Supreme Court."
10,"In 57 days all of our internet activity, phone calls, text messages, email and VOIP will be monitored and stored for 12 months. Here is a manifesto for how we stop it."
10,Epic Fail: McCain Campaign Magnifies CNN/Palin Debacle
10,McCain: Stop questions on Palin background
10,Sarah Palin's Church goes offline (hiding sermon videos)
10,"Peggy Noonan, who was Reagan's speechwriter, just blasted Sarah Palin when she thought the camera's weren't rolling.  You'll be seeing Palin presented as the next Reagan tonight."
10,"FBI Spokesman: No, We did NOT Perform a Background Check on Sarah Palin for John McCain"
10,New York Times SLAMS McCain on Palin Pick 
10,Thousands rally at Ron Paul convention while the RNC sucks
10,"WashPo: McCain Lied. Palin 1st Interviewed Day Before, Never Vetted "
10,Fuck You Joe Lieberman!
10,"National Enquirer says Palin had an affair with her husband's business partner. (Remember, it was the Enquirer that broke the news of John Edwards' affair.)"
10,"Protesters at the GOP Convention were charged with ""conspiracy to commit riot,"" a rarely-used statute that is so vague, it's probably unconstitutional. It basically criminalizes political advocacy."
10,"Republicans Peggy Noonan and Mike Murphy caught on live mics on MSNBC, talking candidly about Palin"
10,FactCheck.org: McCain's Ads Are Lying about Obama's Tax Plan
11,Vote up if you think that voters need to see the list of books Palin tried to ban.
11,Jon Stewart on GOP hypocrisy over the VP issue
11,Vote up if you are sick of being told that McCain is qualified to be President because he was tortured.
11,"Listen AP, it's not ""stretching the truth"". It's called ""lying"". "
11,"""Mrs. Palin needs to be reminded that Jesus Christ was a community organizer and Pontius Pilate was a governor."""
11,"Cindy McCain's RNC Monday Night Outfit Cost $300,000.. Who's the elitist now? "
11,Oh CNN...this couldn't have been an accident.
11,Factchecking Palin's Speech
11,CNN's Roland Martin is PISSED -- His parents were community organizers
11,"Calling your opponent an elitist as you parade around national television wearing $300,000 worth of material: Priceless"
11,The Economist: John McCain’s choice of running-mate raises serious questions about his judgment 
11,"FBI Wanted Obama Plotters Charged, But A Rove Appointee Said No Wednesday, September 03, 2008  "
11,"Drudge: ""PALIN RAISES MONEY -- FOR OBAMA! **Exclusive** Obama scores $8 million since Palin's speech from over 130,000 donors - on pace to hit $10 million by the time John McCain hits stage"" "
11,"Cop drags protester on ground at RNC, others resist and free their friend. It's about time."
11,"Fake Soldiers, Staged Funeral Used In RNC Video...Patriotic Montage Shown At RNC Featured Actors Hired For One Day Shoot, Not Military "
11,"Last night, Sarah Palin gave a speech  meant to get people like me excited about the Republican ticket.   Instead, it sickened me in a very deep and personal way."
11,Palin lied when she said that Obama has never passed a single reform
11,"I don't want a Hockey Mom President if 72yo McCain croaks, so I donated $60 to Obama."
11,Palin's Speech Fact Checked
11,"Real people give Palin an ""F"" on her speech...why don't you vote, 8000+ people can't be wrong"
12,Interesting. The business partner that the National Enquirer alleges that Palin had an affair with? He filed an emergency request to seal his own divorce records on Wednesday. It was denied. 
12,Obama responds on community organizing.  Very well done.
12,"Alaskans Speak (In A Frightened Whisper): Palin Is “Racist, Sexist, Vindictive, And Mean”"
12,"Sarah Palin Will Not Talk to the Press. McCain's Spokeswoman Says: ""Who Cares?"" To the Press: ""Why Should She Talk to ""People Like You?"" Really."
12,"Heart Sends McCain/Palin Cease And Desist On ""Barracuda"""
12,CNN Documents Sarah Palin's Truthiness Problem...FACTchecking finds a troubling number of lies. 
12,"Devastating ABC Investigative Report on Sarah Palin Troopergate, (she clearly lied)"
12,17% of Alaska's GOP delegates casts their votes for Ron Paul - this was not announced aloud by the Chair.
12,McCain's speech last night was suspiciously reminiscent of Bush's in a 2004 Onion piece
12,"Letter written about Sarah Palin by a resident of Wasilla, Alaska"
12,"No doubt, showing a 9/11 video at a political convention was emotional exploitation. But it was also something much worse: it was blatant historical revisionism. "
12,Way to go CNN. Shows McCain protestor during his speech. [img]
12,"During His RNC Speech, McCain Was Standing In Front of a Picture of Walter Reed Middle School of North Hollywood, CA, not Walter Reed Medical Center"
12,NIGHTLINE: Devastating ABC Investigative Report on Troopergate...no holds barred here!
12,Claim: Palin Said She Sold Her Plane On eBay - Fact: She Didn't.
12,"Sarah ""Barracuda"" Palin didn't ask permission to use her new theme song, ""Barracuda,"" by Heart. Republicans: Stealing music is only cool when you do it on national TV, not the internet."
12,"Vanity Fair timeline outlining the inconsistencies in Palin's ""pregnancy"" story"
12,"GOP exploits 9/11 with graphic footage, Keith Olbermann apologizes"
12,"Palin ""bridge to nowhere"" line angers many Alaskans"
12,Republican officials seemed to make Paul's supporters magically disappear during Wednesday night's roll call vote.
13,"Every upvote spreads the news of Palin's affair a little more (Palin cheated with Brad Hanson, her husband's business partner)"
13,Jon Stewart Obliterates McCain's Acceptance Speech
13,"The year old, ""CIA Coke Plane"" story has finally gone mainstream. Score one for supposedly unreliable internet reporting!"
13,"Barack Obama: ""if these are public entities, then they've got to get out of the profit-making business, and if they're private entities, then we don't bail them out."""
13,"Sarah Palin didn't just lobby for earmarks, she's the queen of earmarks (graph)"
