1,Bush surrenders
148,"Rush Limbaugh, Who Once Suggested Dissent Was Treason, Now Says He Wants Obama's Plans To Fail"
148,"FBI raid uncovers massive ""Pay-to-Play"" scheme in Pennsylvania including $58,000 to Republican state chariman."
148,"Helen Thomas, the only reporter with Brass Balls and Dana Perino's worst nightmare, reflects on eight years of Bush"
148,"The Palestinians, in Israeli officials' own words: ""When we have settled the land, all the Arabs will be able to do about it will be to scurry around like drugged roaches in a bottle"" ... "
148,Police and Thieves: The Supreme Court rules in favor of wrongfully acquired evidence.
148,Newspapers around the World blast bush as 'worst' and 'disastrous'
148,Scale of Gaza destruction emerges
148,"When the state wants to prosecute you and they know they have no case, they'll give FELLOW INMATES the chance to squeal on you for alledgedly bragging for a reduced sentence. RAILROADING."
148,"With 6.7 Million in prison, 22 Million unemployed, and 46 Million uninsured, will America ever get it's act together?"
149,GTFO!
149,Presidential approval ratings - last 11 presidents [Graph]
149,This is a list of sites to watch the Obama inauguration live online. Please add to it so we all have backup sources.
149,"""People will judge you based on what you build; not what you destroy"" -Barack Obama"
149,Obama freezes Bush's midnight resolutions
149,"The idea that ""elites"" will ""get serious about repairing the safety net"" if they are FIRST given billions of dollars... is the height of naivete."
149,"Kucinich to banker at hearing: ""That statement that you just made? You will hear about for the rest of your career."" "
149,Obama is now officially the President of the United States!
149,Laws Cannot Prevent Underage Sex... It only Makes Sex Offendrers Out of Children
149,Obama Must Prosecute Bush War Crimes - Keith Olbermann
149,&lt;/BUSH&gt;
149,"Is it just me (and my wife) or was Elizabeth Alexander's poem profoundly uninspiring and oddly nonpoetic, especially sandwiched as it was between Obama's speech and the moving benediction?"
149,"Ok, I'm an agnostic of sorts, and not big on the atheism debate, but this Rick Warren speech is wholly inappropriate."
149,"Constitutional Expert Fein: To Uphold Rule of Law, Obama Must Prosecute Bush, Cheney and the Rest of the Boys"
149,"Chomsky: Two weeks after Israel's assault on Gaza, UN's aid agency announced that the Israeli military refused to allow aid shipments to Gaza - saying that the crossings were closed for the Sabbath"
149,"On CNN, Wolf Blitzer Said, ""John Roberts Had One Job To Do Today And He Sort Of Screwed Up."" Jeffrey Toobin Replied, ""I Almost Fell Out Of My Chair."" "
149,Did your news station mute the crowd boos when they brought GW Bush out?
149,Bush vs. Obama (the inaugural addresses analyzed) 
149,Cheney Injures Back While Changing From Bat-Form To Human-Form
149,My Inauguration Pictures! (Including Government Snipers)
150,Obama halts Gitmo trials until further notice!
150,How to Stump Anti-Abortionists With One Simple Question (with video)
150,Barack Obama announces sweeping rules limiting involvement of lobbyists in his White House.
150,Obama takes the oath again.  Suck on that right wing nut jobs.
150,"""Sorry about that Bush presidency, folks."" - A Southern newspaper apologizes for backing Bush"
150,"In case you forgot, here's a man that knows how to leave office..."
150,Should Children be Branded Sex Offender for Life for Sending Nude Photos of Themselves? 6 Teens Arrested
150,"""Most Americans still think Hawaii actually wanted to become part of their country, never knowing that we're a conquered Nation and deeply resent our loss of Sovereignty."""
150,"Limbaugh Hates America: Hopes Our Country Fails (Why is this draft-dodging, drug addict still on the air?)"
150,Am I the only one awaiting a DELUGE of Bush Administration leaks to pop up on Wikileaks in the next few days?
150,"Whitehouse.gov section on Katrina officially recognizes Bush's ""broken promises"" and ""unconscionable ineptitude"""
150,Lazy Nation Fears Obama Will Create Millions Of Jobs
150,"Bush Booed.  ""That is not what I expected."""
150,"""Blimey. It looks like the Internets won!"" UK campaign for transparency make PM back down."
150,Obama Freezes Salaries of Top White House Officials
150,"People are actually claiming that Obama is not the president because the Oath of Office was flubbed. This is what he meant by ""putting away childish things."""
150,UN chief demands investigation into Israeli attack on Gaza headquarters
150,Republicans don't want to confirm Holder as ATTORNEY GENERAL unless he promises to ignore the law and not prosecute Bush.
150,Two Republicans co-author a medical marijuana bill for Minnesota's state senate
150,"Obama takes action, orders 120-Day Halt to Legal Proceedings at Guantanamo"
151,Bush's records to be made public!  Obama overturns secrecy on former president's records!
151,"Mr. Bush and friends felt Obama used the inaugural to take ""unnecessary shots"" at Bush.    Sorry, they were absolutely necessary shots at Bush."
151,"By a wide margin --  58-40% -- Americans say that torture should never be used, no matter the circumstances. "
151,LIMBAUGH: What I’m afraid of is that what Obama did with this executive order is actually make it easier for the media to go get Bush documents
151,"OK Reddit, You want to Track Obama's Promises?  Then here ya go."
151,Senator Cornyn is holding up the Eric Holder nomination over concerns that Holder may prosecute torture under Bush.  Isn't the Attorney General's job to prosecute people who broke the law?
151,Obama signs order to close Guantanamo. I just got my donation's worth.
151,Tom Tomorrow predicts the likely revelations about the Bush Administration in the weeks to come
151,Obamas Have Open House at White House on First Day - Michelle invites those without tickets in
151,"Matt Taibbi:  ""Someone Take Away Thomas Friedman's Computer Before He Types Another Sentence"""
151,Glenn Greenwald - Obama will have spent his first several days in office issuing a series of executive orders which meet or actually exceed even the most optimistic expectations of civil libertarians
151,"David Iglesias, one of the US Attorneys who were fired for actually trying to do their jobs by Bush,  has just been tapped by the Obama administration to prosecute Gitmo detainees."
151,"Israeli journalist: ""We have gained nothing in this war save hundreds of graves, some of them very small"""
151,"Can We Dispense with the Idea That Bush Kept America Safe? US military deaths in Iraq at 4,229 "
151,Obama’s top priority upon taking office was to institute limits on his own power. - Impressing Radley Balko
151,"Whistleblower: NSA Spied On Everyone, Targeted Journalists"
151,Whistleblower: Bush was Spying on Journalists 24/7
151,"After years of staying on their knees for Bush, Pelosi and Reid now say ""it's not our job to answer to Obama"""
151,"Obama: Suck It, Bush.  I'm releasing your records."
151,The man who put Barack Obama in office and regained the House and Senate for the Democrats leaves the DNC.  Howard Dean. He showed the way to win. 
152,"President Obama - Roe v. Wade not only protects women's health and reproductive freedom, but stands for a broader principle: that government should not intrude on our most private family matters."
152,Who here has visited whitehouse.gov more times in the past week than they have in the past 8 years?  *Raises hand.
152,Jon Stewart: Limbaugh's desire for Obama to 'fail' is 'arguably treasonous'
152,Ass hat senator wants to send people to prison for 5 years for profanity.
152,Obama shuts network of CIA 'ghost prisons'
152,"National Republican Congressional Commitee web site: ""Thanks to Republican economic policies, the U.S. economy is robust and job creation is strong."""
152,Merrill Lynch Execs Paid Themselves $15 Billion on $21.5 Billion in Losses 
152,Barack Obama wants Israel to re-open Gaza border crossing *IMMEDIATELY*
152,"Obama nullifies every legal order and opinion on interrogations issued by any lawyer in the executive branch after Sept. 11, 2001"
152,  TAKE THE MIDDLE EAST GEOGRAPHY QUIZ....This is Humbling!!
152,"Obama slams companies for squandering bailout  funds: “...over the last couple of days about companies (receiving) taxpayer assistance (and) then going out and renovating bathrooms or offices.."""
152,"$180,000 of clothing now sits in trashbags at the RNC HQ. "
152,"Limbaugh, like Coulter, thrives by antagonizing us. Ignore him and he'll go away."
152,Obama Sides With Bush in Spy Case weighing whether a U.S. president may bypass Congress and establish a program of eavesdropping on Americans without warrants.
152,We know a lot more about Barack Obama than we did on Election Day. He wastes little time making big decisions.
152,"House Majority Whip James Clyburn (D-SC) became the latest Democrat to push back against talk show host Rush Limbaugh, who recently said of President Obama, ""I hope he fails."" "
152,"So does anyone else find it a sad state of affairs when America is pleasantly surprised, even taken aback that a politician is holding himself to the promises he made during his campaign?"
152,"Obama visits press room to say hello, restates he is there to visit, Fox News reports on 'irritated' Obama that stared down reporter, foxnews.com users attack president."
152,Where did the Bailout Money Go?  They Won't Say
152,Iceland's Prime Minister Has Resigned
153,"Einstein on Prohibition: ""Nothing is more destructive of respect for the government than passing laws which cannot be enforced."""
153,Prosecute George W. Bush for Illegal Acts
153,Obama: Quit Listening to Rush Limbaugh if You Want to Get Things Done
153,"Obama Says Train’s Leaving the Station: If you want the lunatic fringe to run your party even further into the ground, keep listening to and singing Limbaugh and O’Reilly’s themes of hate and division"
153,"All24, Wyatt22 and Number86 Are spamming the exact same message to every Obama submission. Check his profile, report him, and have the account banned. "
153,"In my opinion, lobbyists are not the problem. They’re simply following the money, and serving their clients. Our problems are an unaccountable Congress and Executive branch. "
153,"Palestinian child (on Aljazeera): ""We don’t get to play, we don’t get to laugh, we don’t get to learn. I turn the TV on; all I see is funerals, shooting, death, war, tanks, and invasion"""
153,Republicans back up criticism of stimulus plan by citing fictional report
153,President Obama's First Weekly Address
153,"Obama's opponents want us to think he's a Messiah figure. That way, when it becomes clear that he isn't, they can turn our disappointment to their advantage."
153,Bush left 'sickening legacy' says Saudi Ambassador
153,"Rush Limbaugh reveals his ""formula for making you, the listener mad"" in an early candid PATV interview. (excerpts)"
153,"In Israel, detachment from reality is now the norm"
153," Shhh. Obama Repeals the Abortion Gag Rule, Very Quietly"
153,Holy Shit! Obama yesterday eliminated the most controversial tools employed by his predecessor against terrorism suspects...declared an end to the “war on terror”
153,"For the love of GOD will people stop saying ""Obama's airstrike in Pakistan""? Predator Drones need NO PRESIDENTIAL APPROVAL to attack."
153,"With every passing day, it becomes more and more apparent that Bush and Rumsfeld will be tried by the UN for war crimes."
153,"Very Nice! 1,474-Megapixel Pic of Obama's Inauguration."
153,Franken Attorney: Coleman Team Doctoring Evidence in Election Contest Lawsuit - And other news briefs from the ongoing U.S. Senate race in Minnesota...
153,A Conservative speaks: Republican philosophy has been now reduced to: 1) government is bad; 2) big government is the worst. It is errant nonsense and wrong in every conceivable way
154,Republicans promise to filibuster every stimulus package unless the Bush tax cuts for the rich are made permanent.  Sigh..
154,The legalization of Marijuana will cut $17 Billion annually from The United States Federal Budget as well as save countless destroyed lives.
154,President Barack Obama 'Offensive.' Sam's Club Says So
154,"Parents Beware, No Child Left Behind Act is Used as a Sneaky Military Recruitment Tool and you Don't Even Know it!"
154,"[Tony Blenn Interview]: Saddam Hussein called for a live satellite debate with President Bush, so ""the world could see the evidence"". "
154,"TRANSPARENCY 2.0: Obama to launch Recovery.gov, a website dedicated to keeping track of all the money the government spends in the stimulus package."
154,Doctors saves money by cutting out the middlemen: provides health care without dealing with insurance companies
154,Palin Aides To Be Charged With Ethics VIolations
154,"In light of NSA spying on all US communications, should encryption technology become standard for ALL email programs?"
154,Vatican accuses Obama of Arrogance.
154,PROSECUTE!: A gang of GOP crooks deliberately impoverished millions with a calculated program of unfair taxation from which only the top one percent benefited.
154,"Australian family caged, detained, starved and deported by US customs"
154,Bush by the Numbers - Warning: very scary statistics ahead
154,Score Another for Obama: He Lifts Global Gag Order
154,"""the Obama administration has indicated it wants to give a waiver to a lobbyist for a big defense contractor who has been nominated as deputy secretary of defense"""
154,"In 2003, a ""10-year-old boy"" sent a letter to all US Senators asking for their favorite jokes.  Here is John McCain's joke."
154,"Why is AP Misleading its Readers Into Thinking Closing Guantanamo is About ""Terrorists' Rights""?"
154,TYPICAL: Republicans claim a government report reveals stimulus plan would fail. Media doesn't fact check and pushes the meme. Turns out the report never even existed.
154,Congressman Schumer Backs Prosecution of Bush Officials
154,"Inauguration Crowd Count: If there was at least 2,365,000 sq ft of spectators, there must have been..."
155,"SHAMEFUL: Obama administration digs into Gitmo legal cases and finds that no case files exist for detainees. As we all suspected, Bush was just winging it cowboy style."
155,"""the look on his face was like no look I'd ever seen on George Bush's face in my life."" (scroll down)"
155,"Monsanto is 'wiping out' hundreds of farmers in southern Illinois by hiring thugs to harass, threaten and abuse farmers and pushing them into bankruptcy through lawsuits against patent infringement"
155,"CNN: the U.S. must 'take all necessary steps to bring George W. Bush and Donald Rumsfeld to court', says U.N. "
155,Holy Cow! Top Democrats Are Actually Talking About Investigating Bush's Criminal Acts
155,America takes another bold step towards becoming a police state. Supreme Court rules cops can frisk a passenger in a car stopped for a traffic violation even if nothing indicates the passenger has committed a crime or is about to do so
155,"Scientist's mid-’90s research found cure for type I diabetes in mice using adult stem cells. Big pharma refused to sponsor clinical trials, putting profit over principle"
155,Rove Subpoenaed
155,Cannabis reclassified from Class C to Class B in Britain
155,"Fellow Obama supporters: Let's not shirk off criticisms of Obama!-- His transparency initiatives (whether complete or not) invite us to be active, informed critics."
155,"The New York Times Gives Bill ""Wrong-About-Everything"" Kristol the Pink Slip"
155,Karl Rove subpoenaed a second time and this time he doesn't have many friends left in Washington to let him ignore the subpoena
155,America's #1 Request of Obama... Legalize Pot
155,"The Republican Party who are 55% pro torture and who applauded Bush’s torture into law, severely weakened America's national security."
155,"Regarding Republican filibuster threats: Make the bastards actually DO the filibuster, not just threaten it. If they shut down government in the process, they're the ones who will be held responsible."
155,McCain Says He Won't Vote for Stimulus Package Unless it Makes Bush Tax Cus Permanent--Why Should Anyone Care What McCain Says?
155,Right wing pundits reduced to completely making shit up.
155,Feingold Introduces 28th Amendment
155,"Reagan on Torture: ""an abhorrent practice unfortunately still prevalent in the world today,"" 1988"
155,Two Legal Standards in VA: One for the Cops and One for the People
156,"Obama was like, ""Dude, that's not cool"" and Citigroup was all, ""My bad."""
156,"after cop shoots citizen, police began confiscating cell phones containing videos that have yet to see the light of day"
156,Here are the most eloquent last words I've ever read.  
156,"With Cheney gone, Google gains sky view of VP's home"
156,"Lobbyists are bemoaning President Obama’s strict ethics rules, which “are viewed by many on K Street as effectively a ban,” “making it nearly impossible for lobbyists who would take senior positions in government to enter public service.”"
156,"Obama's first interview as President given to Al Arabiya; tells Muslim world, ""Americans are not your enemy"""
156,"Ex-governor Siegelman says Rove subpoena ''restores people's faith in democracy"""
156,"Ron Paul: ""Terrorism is a Tactic. You can’t have a War against a Tactic."""
156,"This is what 400 representatives looks like. Does this look adequate or overwhelming for 1,200,000 people? The citizens have access to their representatives. In California we do not."
156,PBS: NSA Could Have Prevented 9/11 Hijackings
156,"What is the ""Employee Free Choice Act"" and why are Bank of America and Home Depot trying to kill it?"
156,"Three days after receiving $25 billion in federal bailout funds, Bank of America Corp. hosted a conference call with conservative activists and business officials to organize opposition to the U.S. labor community's top legislative priority."
156,"Bloody Monday claims (over) 71,400 jobs in US"
156,Israel's Leaders Are Frantically Trying to Prevent War Crimes Proceedings for Their Gaza Atrocities
156,AIG executive sentenced to 4 years in prison - $500M fraud 
156,Political report: 1 in 4 Americans believe the Bush administration committed war crimes
156,Holocaust denied. Every war Israel has waged since 1948 has had the same objective: expulsion of the native people and theft of more land. Why are we silent?
156,Franken lawyer gets Coleman aide to concede altering ballot evidence
156,"Big surprise: FOX News promoting anti-Obama book filled with ""falsehoods and red herrings"""
156,Are Corporate Bailouts Just Glorified Payday Loans?
157,Recent bailout recipients discussing spending hundreds of millions on lobbying Congress? These people deserve to fail. No more bailouts! 
157,Huffington Post Breaks Huge Corruption Story--And We Must Do Something About It
157,Bill would dock lawmakers a day's pay for failing to vote
157,"3 days after getting $25 billion from the bailout, Bank of America had a call with GOP activists and CEOs on how to spend millions on lobbying. If there was ever a reason for campaign finance reform, this is it."
157,"How can one Senator ANONYMOUSLY hold up a cabinet appointment? This needs to stop, now!"
157,Dennis Kucinich States His Intention To Put The Federal Reserve Under Government Control
157,Oh no -- the economic meltdown is negatively impacting the lifestyles of our nation's bankers' girlfriends!
157,BREAKING NEWS: House passes White House-backed $819 billion economic stimulus bill
157,"FBI: We had good intelligence on the mortgage-fraud schemes, the corrupt attorneys, the corrupt appraisers, the insider schemes, as far back as 2002."
157,"Coleman tries to submit ""faulty evidence"" (modified photocopies of ballots) in Minnesota recount case - Judge says no."
157,Why Are Top Political Leaders From Both Parties So Out-Of-Touch With The Public’s Demand For Marijuana Law Reform?
157,Do police have the right to confiscate your camera?
157,In a sign of bipartisan support not a single Republican voted for Obamas stimulus plan. Thanks assholes.
157,"Congressman Grayson: ""Limbaugh actually was more lucid when he was a drug addict."" "
157,ACLU to Obama: Release Bush's Secret Memos
157,U.S. Senate: KBR  should be held accountable for the electrocution deaths of U.S. soldiers and other mistakes
157,Conservapedia takes down thinly veiled hit-list of Democrat senators whose untimely demise would significantly benefit the GOP
157,"Bush Torture Team Get Out of Jail Free Card | While the world wondered if Bush would pre-emptively pardon his torture gang on the last day, most forgot…he already did."
157,Reality bites.  What we are now seeing is the beginning of an inevitable downward adjustment in American living standards to conform with our actual place in the world.
157,Rush Limbaugh is pretty much in charge of the GOP
158,Ronald Reagan used to tell a story about a welfare queen who collected food stamps while driving a Cadillac. What are we to call people who collect tens of billions from the taxpayer – and then redirect $4 billion to themselves?
158,"Professional poker player gets ""mugged"" by DEA agents who automatically assume that someone who can pay for a first-class airline ticket with cash is a drug dealer"
158,Obama changing up the Presidential style - no jackets allowed in the Oval Office.
158,Bail-Out Banks Caught On A Phone Call Discussing Ways To Use Bail-Out Dollars To Lobby Against Unions...
158,"Military Judge Denies Obama Request to Suspend Guantanamo Hearings - Wait a minute, isn't Obama the Commander-in-Chief?"
158,"Blair (R-Berkeley) proposes legislative bill that would subject anyone collecting food stamps, welfare checks or jobless benefits to random drug testing! "
158,Rove announces he has no intention of obeying Conyers' subpoena 
158,Republicans STILL are trying to sell they are party of smaller government and fiscal responsible AFTER eight years of the largest govt expansion in history and destroying the economy!
158,"Bailout question: Why not give money to homeowners to pay off their mortgages, instead of giving money to the banks? The banks get the money anyways, two birds with one stone, everybody wins. Please educate me as to why this is a bad idea."
158,Obama calls $18B in Wall St. bonuses 'shameful'
158,"VIDEO: Rove Says He Won't Answer Subpoena - O'Reilly: 'If you need a place to hide, we have it here at The Factor'"
158,Blackwater's contract in Iraq will not be renewed.
158,"Today, investment banks, the pride of Wall Street, have virtually ceased to exist. In just 12 months, they have posted losses exceeding the profits they made in the last 25 years. This example alone reflects the real situation better than any criticism"
158,"Bad Bank, Bad:  JPMorgan knew about Madoff much earlier, pulling cash from Madoff-linked funds last Fall"
158,Saddam's hometown unveils statue dedicated to man who threw shoe at President Bush
158,Damnit Fox News…
158,The Doomed Generation - What about Americans about to enter the work force?
158,"Who knew the NSA was spying on virtually all Americans? Pretty much everyone who cared to know. Since prior to the Bush Regime, in fact."
158,"Blackwater Kicked Out Of Of Iraq - ""improper conduct and excessive use of force,"""
158,"Can we Dispense with the bi-partisan fantasy now that Repubs have shown they won't play? We elected Dems to run the government, so do it and let those who don't want to sit on the sidelines."
159,"Congress may finally have had enough: ""We have a bunch of idiots on Wall Street that are kicking sand in the face of the American taxpayer,"" ""They don't get it. These people are idiots. You can't use taxpayer money to pay out 18 billion dollars in bonuses."""
159,"Rove Escapes Testimony, For Now…Bush lawyer directs Rove not to talk to Congress—once again : Just four days before he left office, President Bush instructed former White House aide Karl Rove to refuse to cooperate with future congressional inquiries into alleged misconduct during his administration"
159,"Bush officials authorized torture of US citizen, lawyers say"
159,"Obama throws first punch at Israel, demands war crimes investigations"
159,The whole world is in recession. But the United States is the only wealthy country in which the economic catastrophe will also be a health care catastrophe
159,"Wall Street bonuses are outrageous. If the bailout funds provided by taxpayers were aimed at shoring up the banks, why are these ceo's not being arrested for embezzling this money for personal gain?"
159,1) Be a judge 2) Help Juvenile Hall Operator get $58 Mil contract 3) Send Kids to Juvenile Hall 4) Receive kickback from Operator 5) $2.6 Mil Profit! 
159,Will The DEA Raids Continue? Now Even The Mainstream Media Is Asking The Question
159,"Days Before Leaving Office, Bush's Lawyer Told Rove Not To Turn Over Any Documents"
159,46 out of 50 States Will Be Bankrupt by Mid-2009 According to the Center on Budget and Policy Priorities. States can not run deficits which means services will be cut (Education/Police/Fire/etc.) 
159,"Ron Paul takes C-SPAN Phone Caller Questions: ""Reagan added to the deficit, grew government"""
159,Chomsky explains the history of US propaganda 
159,"Under Republican Gov. Ehrlich and Lt. Governor Steele (Now RNC Chair), Maryland State Police Spied On Many Peaceful Groups"
159," Republicans: ""Go To Hell America!"" 100% Partisan Vote"
159,Keith Olbermann gets the scoop on what will happen to Karl Rove if he doesn't show for his court date.  J-A-I-L?
159,McCain expressed disappointment on Friday that President Obama has not negotiated with Republicans over economic stimulus package. Hey asshole you guys had the power the last 8 years and you fucked everything up so tough shit pal
