1,Bush surrenders
46,"McCain Told Reporter ""He Would Hate To Live in Milwaukee"" - wave goodbye to Wisconsin, Mr. McCain"
47,John McCain: What the fuck? (Whoever does these is brilliant!)
47,"""I've heard Obama is an Arab."" McCain: ""No ma'am, he is a decent family man and citizen."""
47,Obama Knew It Was Coming All Along
47," Obama: ""I can take 4 more weeks of McCain's Attacks But America Can't Take 4 More Years Of Failed McCain\Bush Look Alike Policies"""
47,"McCain Supporter: ""Obama is an Arab"""
47,Vote up if you think Tucker Bounds is a douchebag
47,George W. Bush Has Hurt the United States More Than Bin Laden Ever Could Have.
47,McCain Camp Defends The Behavior Of Their Supporters Who Want To Cut off Obama's Head and Kill Him (No Seriously)
47,"McCain: ""Sooner or later, people are going to figure out if all you run is negative attack ads you don't have much of a vision for the future or you're not ready to articulate it."""
47,"Joe Biden: ""You got something to say to a man, look him in the eye and say it to him!"""
47,On 7.30.08 Obama predicts every weak attack McCain campaign is now making
47,"No evidence of any letter sent by McCain to Treasury Secretary Paulson, as he had claimed in the debate.  Campaign not providing answers."
47,"Who is the REAL Sarah Palin? After all, she has far more ties to radical groups than Obama does. Plus, she won't talk to the press about it. What is she hiding?"
47,Obama listed as 'Barack Osama' on absentee ballots
47,Newly uncovered video gives proof that Palin is lying about Troopergate firing of state police chief
47,"Top GOP Strategist: It's Over, Obama Will Win In Landslide"
47,Gettin' Under His Skin? Watch as McCain responds when asked why he won't bring up Ayers to Obama's face. It's a telling reaction.
47,Salon uncovers amazing new details on Palin's Alaskan Independence Party connections.  
47,"Obama Proposes Small Business Rescue Plan, holy crap the glove are off...this is huge."
47,"Comedian/Actress Betty White puts the SMACKDOWN on Palin and McCain...Carrier Pigeons and ""That is one CRAZY bitch"""
48,Bush's Last 100 Days in Office Starts on Sunday.  Vote this up if you can't wait for this epic failure of a president to depart
48,The McCain/Palin ticket is the first in American history in which both candidates were found to have violated ethics standards before a national election.
48,"A man brought a stuffed monkey doll wearing an Obama sticker to a Palin campaign event in Johnstown, Ohio. Realizing he was caught on camera, he passed it off to a child he didn't know."
48,"Conservative columnist David Brooks complains that Republican ""disdain for liberal intellectuals has slipped into a disdain for the educated class as a whole"""
48,"The Nation: ""Sarah Palin Is Out of Her League"""
48,Palin boo'd at the Flyer's game (Video)
48,And The Hits Just Keep On Comin' - AP: Sarah Palin Charged Taxpayers $13k to Attend Her Church 
48,"FOX ""loses"" the satellite feed of Obama spokesman in the middle of vigorous defense of nonsense Ayers claims."
48,McCain calls TrooperGate a partisan inquiry. He's wrong. The committee was composed of 8 Republicans and 4 Democrats.
48,"""Cowboy prank"" by McCain started fire that killed 133 sailors on an aircraft carrier. McCain himself won't deny that it happened. Media ignores it anyway."
48,"ACORN story is HOAX, Obama is not guilty of voter fraud. Now the GOP on the other hand..."
48,Gore's 2000 Lead: 11-points in October.  It's time to make it count.
48,Palin = Fail.
48,"Even presidents deserve some time off now and then. Bush: Took about 900 days off, approximately 30% of his presidency"
48,Out-of-state Mormons pouring millions to defeat gays in California. And they're succeeding.
48,McCain calls TrooperGate a partisan inquiry. He's wrong. The committee was composed of 8 Republicans and 4 Democrats.
48,Newsweek: Obama 52% McCain 41%
48,McCain booed for showing class; grabs mic from stupid woman
48,"Watch McCain Supporter Gayle Quinnell explain to a reporter how she fears Obama will turn the US into a Muslim nation, AFTER McCain tells her he isn't an Arab. Some people just dont get it!"
48,"No, no, no.  McCain does NOT get ""respect +1"" for talking down his racist supporters when he's the one that's been inspiring their racism."
49,"No matter what the polls say, we do Obama a disservice if we believe the polls and assume that he has it locked up. "
49,"Obama knocks on doors, surprises voters...Sue Sekel, a 43-year old healthcare worker dressed for a day of Sunday housecleaning, opened her front door to discover Obama standing before her."
49,"Listen up, John McCain: I Am an Arab and a Decent Man...We are disturbed by the degree to which 'Arab' has become the metaphorical mud to sling against your opponent. "
49,It’s simply not possible to lie more deliberately or flagrantly than this...
49,"I don't want the Republican Party simply defeated in November, I want to see it smashed beyond all recognition, in such wriggling, writhing, anguished disarray that it can barely reconstitute itself"
49,McCain and Palin now claim that TrooperGate report found nothing unethical happened. That's a flat out lie.
49,Reagan won the 1980 Presidential election in THE LAST 5 DAYS. This is not over!
49,"Remember that woman who stood up during a recent McCain rally and said Obama is an arab? Well, she admits ON CAMERA she's using McCain campaign resources to spread this lie. [video]"
49,"On FOX: Bill Kristol Unloads:  McCain Campaign 'Stupid...Pathetic...Flailing'......""it is ridiculous, it's malpractice""...begrudgingly acknowledges Obama's favorable ratings skyrocketing"
49,Report finds Palin broke law in Troopergate. Palin is glad to be vindicated of any wrong doing by the same report. Uhhhhhhhhhhh...what?
49,Sickening...  Virginia GOP Head Tells Volunteers: Compare Obama To Osama
49,Greatest McCain caricature I've seen this election [pic]
49,The McCain-Palin 'Monkey Man' wasn't so shy of the camera BEFORE the rally (VIDEO)
49,"Sarah Palin is Folksy, Charming and Likable... [pic]"
49,"Nun, 106, to back Obama after not voting since 1952 "
49,Americans' Bullshit detectors off charts with Palin
49,"McCain returning to Letterman --In a perfect world, Dave will cancel McCain's appearence at the last second and have Obama on instead."
49,"Crowd chants ""Racist!"" at McCain supporter taunting them with monkey-Obama doll"
49,"6,827,466 views of this McCain Video, I laughed out loud when I saw the Katrina birthday pizza pie, and Lieberman correction."
49,"Is McCain Much Sicker Than We Know? | A source tells CounterPunch that McCain received grim news during a recent, secret visit to a top cancer hospital in Los Angeles"
50,"If idiot conservatives will argue that Obama=Osama, then I submit that Palin=Stalin."
50,"Obama's a Muslim?  Meet the man who started that false rumor ... a man so mentally unbalanced he wasn't allowed to become a lawyer, but Fox gives him air time."
50,"NEW SCANDAL??? It's possible that the contractor that built Palin's il-advised, overpriced sports complex built her $500,000 house - for free!"
50,"ABC: ""Palin Makes Troopergate Assertions That Are Flatly False"""
50,Why smart Republicans are PISSED at their party 
50,Disgraceful:  70% of military absentee ballots will not be counted
50,Vote Obama. McCain lacks the character and temperament to be president. And Palin is simply a disgrace. - By Christopher Hitchens - Slate Magazine
50,ACORN releases photo of McCain at ACORN event
50,"Spread the word, the Nobel Prize Winner for Economics favors Barack Obama's policy proposals."
50,Saturday McCain: We'll be introducing a bold new economic agenda on Monday. Sunday McCain: Sorry. Forget that. We don't have any new economic proposals at this time.
50,"Wait, wait... The father of Bristol Palin's baby has "" dropped out of high school to take a job""? Palin is OKAY with him dropping out of school?!"
50,"What's the deal with Americans having to ""Register to vote""? In Canada, you're a citizen, you get a voting card by mail telling you when and where and that's it."
50,"Bill Ayers killed nobody, and paid his debt in jail for his crimes. John McCain's ""prank"" killed 133 sailors, and he never paid any price. Vote up if you think McCain is a bigger terrorist than Ayers."
50,"NY Post: ""Tina Fey is well on her way to ruining Sarah Palin’s political career."""
50,"Lehman Brothers, a Goldman competitor, was allowed to fail. A week later, we bailed out AIG, who owed Goldman $30 billion. Paulsen has consistently worked to protect his old firm, Goldman Sachs."
50,Palin: Why is everyone talking about the economy when we should be talking about abortion!  
50,"Hey McCain, don't be sarcastic about planetarium projector funding, unless you really do intend to mean that federal spending on public education is unjustified"
50,"Tina Fey On Sarah Palin: ""If She Wins...I'm Leaving Earth"""
50,"Media Rip Palin For Lying About Troopergate Report, But Campaign Keeps Lying"
50,Sean Hannity's 'Obama And Friends' report claimed that Barack Obama trained for a radical overthrow of the government.
51,Vote up if you don't care about Israel any more than you do other countries.
51,You stole our Obama sign = We bought another sign = Obama campaign gets more money
51,John Cleese on Sarah Palin 
51,"[BREAKING] My Brain: McCain's Transition Chief lobbied for Saddam. Yes, the McCain who thinks Obama's ""connection to Ayers"" is relevant."
51,"Chris Buckley is fired from the National Review, the magazine founded by his father in 1955, for endorsing Obama."
51,"BARACK'S BRILLIANT PLAN:  Obama's Economic Rescue Package So On The Mark It Would Be A True Game Changer, In A Good Way"
51,"Does anyone else here really love Keith Olbermann and Rachel Maddow, but wish they would tone down a little?  They're becoming a bit too O'Reilly-ish for me."
51,"Rachel Maddow on Calling a liar, a liar"
51,If McCain cannot run a campaign...he sure as HELL couldn't  run the USA
51,McCain Transition Chief Aided Saddam In Lobbying Effort
51,"If We Can Nationalize Banks, Why Not Healthcare?"
51,"This matters to me in part because she violated an ethics statute, but mostly because I don't want a vice president who is petty and vindictive. "
51,Obama explains his tax plan to plumbing business owner
51,"Palin’s Hometown Paper Slams Her Response To Troopergate Report: “An Embarrasment”, “Ignorant Or Orwellian”"
51,Canadian Redditors: Get out and vote! Polls are open 9:30am to 9:30pm
51,"It's pathetic to hear right-wing talk radio blowhards associate Barack Obama with ""socialist"" views when a Republican administration is tossing aside ""Atlas Shrugged"" and speed-reading ""Das Kapital."""
51,Maddow chats with Frum about tone in the election.  Frum tries to equate Maddow's show with threats of violence.  So Maddow kicks his ass.
51,Is this the TRUE level of political discourse in the US?!?!
51,"Shit -&gt; Fan... Bipartisan Congressional Investigation ordered into NSA's ""Passing around of phone sex and pillow talk calls of american soldiers as a sort of amusement""..."
51,"As the Violence Soars, Mexico Signals It's Had Enough of America's Stupid War on Drugs- now its president wants to decriminalize pot, cocaine and heroin possession"
52,"Plumber asks Obama spontaneous question. Obama spends four minutes giving him a detailed, cogent, respectful answer. Good stuff."
52,"""Tina Fey has actually done more interviews about playing Sarah Palin than Sarah Palin has done about being Sarah Palin!"""
52,"Holy crap, Bob Schieffer is a mindblowingly good moderator."
52,"The Daily Show does it again: The NEW, New John McCain [Video]"
52,"Palin calls New Hampshire part of the ""Great Northwest"" --- and is roundly booed "
52,"WSJ Opinion Piece: My friend Bill Ayers (Chicago's ""Citizen of the Year"" in 1997)"
52,"Trump tells CNN that Bush should have been impeached, calls Bush a liar"
52,"So, Republicans, which is it? Is Sarah Palin shockingly dishonest or is she functionally illiterate? Inquiring minds want to know."
52,"Rachel Maddow - Sarah Palin has strong connections with the anti-American, anti-government and extreme-right wing Independence Party"
52,"McCain math:  25,000 people came to our rally!  Problem 1:  Arena holds only 16k.  Problem 2:  Fire marshall estimates crowd at 12k."
52,"Oh, The Irony: In 2006, John McCain Was The Keynote Speaker For An ACORN Sponsored Conference on Immigration Reform and Praised The Group As 'What Makes America Special' [with video]"
52,"Official Republican Website on Obama: ""Waterboard Him"""
52,"Since taking office in late 2006, Palin and her family have spent more than $13,000 in taxpayer funds to attend religious events and meetings"
52,Hayden Panettiere: “Nobody Fucks With John McCain”
52,Colin Powell Is Ready To Endorse...Obama?
52,McCain Finance cochair in Florida passes around joke about murdering Obama and his wife
52,McCain comes out against net neutrality
52,"This picture, along with this quote, explain in the simplest terms why I am so proud to support Barack Obama."
52,Whoa!  CNN on the Palins and the fringe...Todd Palin's membership in the anti-American radical group Alaska Independent Party
52,"Alaska's Largest Paper Labels Palin ""Orwellian"""
53,"Al-Jazeera Reports At A Sarah Palin Rally In Rural Ohio -- “I’m afraid if he wins, the blacks will take over."" [incredible video]"
53,"Vote up if you would still vote for Obama even if he were a Muslim, Jew, Zoroastrian, Cannibal, Zombie, or Decepticon."
53,MCCAIN'S DEER IN HEADLIGHTS MOMENT
53,Who doesn't give a fuck about Joe the plumber?
53,"Vote up if you think ""Joe the Plumber"" was a Republican Plant"
53,"Obama is out with a post-debate ad...""Senator Obama, I'm not George Bush""...but"
53,Dear Joe the Plumber: The Plumbers Union supports Senator Obama.
53,Wow. One hell of an anti-Sarah Palin rape ad ran on CNN just following the debate
53,"Reddit: Did Anyone Else Think That McCain Came Across As A Smug, Cantankerous Geriatric?"
53,"McCain: ""That, to me, was so hurtful. "" Obama: ""I think the American people are less interested in our hurt feelings."" Win."
53,"""Governor Palin, I didn't have a choice about being raped. But I should have a choice about this."""
53,"""ZERO?!"" McCain struck speechless when Obama presents the facts about his health care plan. [video]"
53,"""John McCain tonight was facetious, smirking, sarcastic, disrespectful, brooding, dismissive, rude, mean, condescending, and wound up tight."""
53,What the shit? Obama winning Fox News poll!
53,"Joe ""The Plumber"" Wurzelbacher, who ""concern trolled"" Obama on tax plan, is reportedly NOT registered to vote. EPIC FAIL"
53,"Joe the plumber has a lien placed against him to the tune of $1,182.92.  He hates taxes so much he doesn't pay them"
53,"""Dear Red States..."" A Letter From The Blue! "
53,Joe The Plumber Admits He Wasn't Undecided After All ...and totally on message for McCain
53,"Obama's tax plan would only tax the PROFITS of businesses making over 250K per year, that is AFTER paying its owner a salary, not the REVENUE of the business.  Got that?"
53,McCain you dumb fuck.  Sarah Palin's kid doesn't have autism!!!!
54,"Vote up if you want the United States to end the war, make wiretapping illegal, invest in clean energy and rid Congress of people who will get in the way of these goals."
54,"National Review says Obama's deceased mother would've aborted him, were it legal at the time. What the FUCK is wrong with them."
54,"BREAKING: U.S. Supreme Court says GOP ""voter fraud"" allegations are bogus"
54,"McCain's roast of Obama is funny, too."
54,"Wow: Idiot right-wing radio host doesn't recognize the flag of Ohio, asserts Obama was standing in front of an ""O flag"", calls him an aspiring ""dictator"""
54,"Joe the Plumber is a fraud: his real name is Sam, is unlicensed, is a registered Republican, and owes back taxes to Ohio"
54,"Darcy Burner stood up for the Constitution by opposing the ""FISA compromise"".  Now, her opponent is trying to use this against her.  America needs people like Darcy Burner in Congress."
54,"Joe the ""plumber"" is not legally a plumber, only made 40K in 2006, and has no specific plans to buy the business (which only has estimated revenues of $100K)... but he is a registered Republican"
54,Reddit! Let's help kick Michelle Bachmann out of Congress. NOW.
54,Mr. Obama embraces the theory of evolution and argues that the teaching of intelligent design and other creationist ideas “cloud” a student’s understanding of science.
54,‘Joe The Plumber’ Comes Clean: ‘I Would Be Receiving Obama’s Tax Cuts’ 
54,"Ignorant Christian Fascism is not a recipe for success, it's Saudi Arabia under a different prophet.  Count me out"
54,"ACORN: McCain said it was ""destroying the fabric of democracy"" - but Slate explains how this fabricated controversy is covering up Republican voter suppression."
54,"Conservative Chicago Tribune endorses Obama : ""We have tremendous confidence in his intellectual rigor, his moral compass and his ability to make sound, thoughtful, careful decisions."""
54,It's a good thing for John McCain that only American citizens can vote in U.S. presidential elections...
54,"David Letterman is the only one with the guts to ask John McCain about his association with G. Gordon Liddy, that other domestic terrorist."
54,Right. Wing. Stupid. [PIC]
54,"Michelle Bachmann [R-MN] claims that Barack &amp; Michelle Obama hold anti-American views. She also wants members of congress investigated to ""find out if they are pro-America or anti-America."""
54,ROLLING STONE: It's Already Stolen
54,"Palin says she likes visiting ""pro-America"" parts of the country, doesn't specify how she determines which parts of America are anti-American."
55,"Obama Rally Draws 100,000 in Missouri (with pic)."
55,"If Obama loses the election, will you immediately suspect voting fraud?"
55,"Polls aren't votes - This ain't over til the fat lady sings. College students: your absentee ballot deadlines are NEXT week. Vote this up, then tell your friends, then e-mail your school newspaper. "
55,GOP Controlled Voting Machines Switch Obama Votes To McCain
55,Defeat Michelle Bachman
55,"Editor of ""The Nation"" is outraged by calls for a McCarthy-like investigation of Obama and members of Congress, to determine whether or not they are ""Anti-American.""  She doesn't hold back."
55,"Congresswoman Bachmann accused all ""liberals"" of being anti-American agents, let's kick her out of congress - fund the campaign of her district's opponent as his donations continue to surge"
55,HATE-FILLED PHONE CALLS...Republicans Rain Negative Automated Calls on Voters in Swing States 
55,"You cannot believe how many people have told me to call them on 20 January. They say, ""You wanna know about abuses and violations? Call me then."""
55,"This is nothing but modern day McCarthyism (McCainism?) and it is despicable. Please support Tinklenberg, he's only 4 points down!"
55,Today Barack Obama quietly bought food for a widow and a disabled roofer in need.
55,mccainmotherfucker_1.jpg 
55,Michelle Bachmann gives voice to the right's darkest impulses
55,Fully Informed Jurors Need to Know of Jury Nullification - The Most Important Right of Free People
55,Michelle Bachmann Raises Half A Million Dollars In 24 Hours — For Her Opponent
55,This Race May Be Tightening: Do Not Be Complacent.
55,"She has called for the poisoning of a Supreme Court Justice, the assassination of a sitting US president, and bombing one of the largest newspapers in the country.  And she's your hero Michele?"
55,Alaska's black leaders say Sarah Palin's campaign is like going to a Ku Klux Klan rally
55,Breaking: Obama requests special prosecutor to investigate Bush-McCain DOJ &amp; voter fraud
55,Censure Michele Bachmann of Minnesota who claimed that Obama and other members of Congress share anti-American views.
56,The only man in the Bush cabinet who had any qualifications whatsoever endorsed Barack Obama this morning.
56,"Todd Palin: America's ""Core Values"" Are ""Hunting And Fishing."" Raise your hand, everyone who could care less about hunting and fishing as long as they still have a job and can eat."
56,"colin powell: the really right answer is, ""what if he is a muslim?"" respect++"
56,Election News: Head of California GOP Voter Registration Outlet ARRESTED for Registration Fraud.
56,Colin Powell: Country First (Wow! Very well done video)
56,Barack Obama is the shit. [Pic]
56,"Colin Powell Eviscerates McCain's Negative Smear Campaign...Ayers is over the top...and smacks Michele Bachmann's rant, silly. "
56,More West Virginia voters say machines are switching votes from Obama to McCain
56,Colin Powell points out the obvious: It's bad that calling someone a Muslim is now a political smear
56,"David Letterman asked McCain about Liddy, putting the nation's journalists to shame in the process. "
56,"Votes for Obama not being counted in NC, if you vote straight ticket democrat"
56,"A devastating blow to John McCain...I have never heard such a devastating and thoroughgoing critique of McCain's issue-free, fear-mongering campaign, the way he did it was stunning."
56,Gen. Collin Powell Breaks it down on NBC. Obama vs. McCain [SO GOOD!]
56,"Here is the photo Colin Powell was referring to on Meet the Press -- Kareem Rashad Sultan Khan, and he was an American"
56,"Just over fifty years ago, Joseph McCarthy attacked Edward R. Murrow with some of the exact same language that John McCain and Sarah Palin are using today to attack Barack Obama."
56,Colin Powell Endorses Barack Obama on Meet The Press
56,"McCain aides say they prefer endorsement from an unlicensed plumber over endorsement from 4-star general, former Secy of State, Natl Sec. Advisor, and Chrmn of Joint Chiefs of Staff Colin Powell. "
56,"After her opponent raises $450,000 in a day, Michele Bachmann claims everyone just ""misread"" what she said about investigating anti-American members of Congress"
56,Massive McCain Rally.  
56,Republicans fear bloodbath in Congress. .. International law calls for bush to hang for institutionalizing torture even after his  illegal war on Iraq for Oil. 
57,"If you live in CA, CO, FL, IL, IN, IA, MI, MN, , MO, NV, NH, NJ, NM, NY, NC, OH, TX, VA, WA or WI you can vote TODAY. Here is how you do it. Vote up to end this election before it starts. "
57,"Kucinich calls for probe into $70 billion bonuses for employees of failed banking firms: ""It would add insult to injury to ask taxpayers not only to bailout a firm, but to pay for bonuses as well."""
57,Obama vs. McCain Tax Plans: The Washington Post's graph drawn to scale (try to get as many people as possible to see this before Election Day!)
57,"""He's got a confederate tattoo on his arm. He strolled into our headqtrs...saying Obama was the only person who made any sense to him...."" [PIC]"
57,"WARNING: If you vote ""straight ticket"" in NC or SC it does not count a vote for President!  You need to also check the box for the Presidential candidate!!"
57,"Isn't Sarah Palin a ""socialist"" too? Didn't she redistribute the wealth in Alaska by taking the oil profits, impose a tax and kick it back to Alaskans?"
57,"""Get the Obama signs off your property—now,"" the letter reads. ""Failure to obey this order will result in the immediate death of all family members."""
57,Obama Assembles U.S.'s `Largest Law Firm' to Monitor Election  
57,"As far as I'm concerned, Voter Suppression = Treason.  It a) Subverts the government, b) Directly harms the citizens, and c) Puts the whole nation at risk.  Treason. What's the penalty for that again?"
57,Stop covering Palin until she gives a press conference -- The Press beings to revolt to the McCain campaign's attempt to hide Palin from answering tough questions
57,"If you think ""Drill, baby, drill!"" will cut your gas prices, think again. All OPEC has to do is cut production by an equivalent amount, and up goes the price."
57,Even Family Guy is taking shots at McCain-Palin.
57,"This is why America is broken, this is how some people use their vote."
57,I Want Sarah Palin's Medical Records (Vote Up If You Do Too)
57,Freddie Mac secretly paid a Republican consulting firm $2 million to kill legislation that would have regulated and trimmed it and Fannie Mae
57,"Finally, The NYTimes Asks If McCain Is Going to Survive Four Years. The Press Has Ignored His Age and Health for Too Long. Questions, Serious Questions, Are Long Overdue. Will We Get Answers?"
57,ACLU Tells Court: Congress Cannot Grant Wholesale Immunity to Telecoms; FISA 2008 Act is Unconstitutional
57,"""If Barack Obama or John McCain wants to find a federal program that wastes hundreds of billions of dollars, he can take the scalpel (or better yet the hatchet) to the national war on drugs."""
57,"McCain requests financial contribution to his Presidential campaign from Russia. Gets a ""No"" [official Press Release]"
57,Right-wing radio host mistakes the Ohio state flag for one he thinks was designed for Obama's campaign
58,Keith Olberman discovers a fascinating bit of history from 1991
58,"John McCain commits his biggest gaffe of the campaign so far. Somehow, he manages to out-Bush George W. Bush. This is an instant classic. [video]"
58,Palin Needs A Good Lawyer. AP Documents Potential Fraud In Travel Billing
58,"Michelle Obama's extravagent room service lunch of lobster, caviar, and champagne? Yeah... never happened.  Shocked, huh?"
58,"Order 81. Under this mandate, Iraq's commercial farmers must now buy ""registered seeds."" These are normally imported by Monsanto, Cargill and the World Wide Wheat Company. "
58,"""arrest every Muslim who crosses the state line"" - current U.S. Senator - help his opponent - it's a close race"
58,Jon Stewart on Understanding Real America in Wasilla ... the guy with the tattoo really says it all ... Wasilla Mayor clears it right up.
